{
  "schema_version": 1,
  "wave": 2,
  "closure_status": "EXACT_CLOSED",
  "release_intent": "none",
  "tracked_relative_path": "specs/013-owner-scoped-prebuild-cleanup/wave-closure-v1.json",
  "accepted_candidate_sha": "d6460b3742d499eb1bd5064573606dc5e44b4952",
  "closure_receipt": {
    "relative_path": "specs/013-owner-scoped-prebuild-cleanup/acceptance-receipt.md",
    "sha256": "fb099a8133fb43caba233ddc6cc59be5462f4446bb9ef05a585a85e618808c72"
  },
  "integration": {
    "kind": "pull_request_head",
    "pull_request": 289,
    "head_ref": "work/issue450-owner-scoped-cleanup",
    "head_sha": "d6460b3742d499eb1bd5064573606dc5e44b4952"
  }
}
